"deposition_id","record_id","state","submitted","title","version_doi","concept_doi","doi_url","record_url"
"18522532","18522532","done","True","G_1 Explanation Has No Legitimacy Standing","10.5281/zenodo.18522532","10.5281/zenodo.18522531","https://doi.org/10.5281/zenodo.18522532","https://zenodo.org/records/18522532"
"18522513","18522513","done","True","F4 Why Certain Explanations Can Never Be Coherent","10.5281/zenodo.18522513","10.5281/zenodo.18522512","https://doi.org/10.5281/zenodo.18522513","https://zenodo.org/records/18522513"
"18522501","18522501","done","True","F3 Admissible vs Illicit Metaphors","10.5281/zenodo.18522501","10.5281/zenodo.18522500","https://doi.org/10.5281/zenodo.18522501","https://zenodo.org/records/18522501"
"18522485","18522485","done","True","F2 Metaphors as Structure Inducing Operators","10.5281/zenodo.18522485","10.5281/zenodo.18522484","https://doi.org/10.5281/zenodo.18522485","https://zenodo.org/records/18522485"
"18522472","18522472","done","True","F1 Meta control Layer","10.5281/zenodo.18522472","10.5281/zenodo.18522471","https://doi.org/10.5281/zenodo.18522472","https://zenodo.org/records/18522472"
"18522455","18522455","done","True","Envelope Physics A Map of Licensed Physical Bookkeeping Regimes","10.5281/zenodo.18522455","10.5281/zenodo.18522454","https://doi.org/10.5281/zenodo.18522455","https://zenodo.org/records/18522455"
"18522442","18522442","done","True","Envelope Conditional Physics What Remains After Maximality","10.5281/zenodo.18522442","10.5281/zenodo.18522441","https://doi.org/10.5281/zenodo.18522442","https://zenodo.org/records/18522442"
"18522434","18522434","done","True","E4 Governance and Institutional Stability via Admissibility","10.5281/zenodo.18522434","10.5281/zenodo.18522433","https://doi.org/10.5281/zenodo.18522434","https://zenodo.org/records/18522434"
"18522414","18522414","done","True","E3 Hallucination as Tensor Failure Not Model Error","10.5281/zenodo.18522414","10.5281/zenodo.18522413","https://doi.org/10.5281/zenodo.18522414","https://zenodo.org/records/18522414"
"18522405","18522405","done","True","E2 AI Epistemic Legitimacy Anchors Tensors Skin","10.5281/zenodo.18522405","10.5281/zenodo.18522404","https://doi.org/10.5281/zenodo.18522405","https://zenodo.org/records/18522405"
"18522388","18522388","done","True","E1 Portability of Role Typed Constraint Systems","10.5281/zenodo.18522388","10.5281/zenodo.18522387","https://doi.org/10.5281/zenodo.18522388","https://zenodo.org/records/18522388"
"18522376","18522376","done","True","Closed Physical Kernels as Admissibility Gates","10.5281/zenodo.18522376","10.5281/zenodo.18522375","https://doi.org/10.5281/zenodo.18522376","https://zenodo.org/records/18522376"
"18522357","18522357","done","True","C_9 Breakpoint and Collapse Signatures","10.5281/zenodo.18522357","10.5281/zenodo.18522356","https://doi.org/10.5281/zenodo.18522357","https://zenodo.org/records/18522357"
"18522323","18522323","done","True","C_8 Tensor Load Redistribution Failure Limits","10.5281/zenodo.18522323","10.5281/zenodo.18522322","https://doi.org/10.5281/zenodo.18522323","https://zenodo.org/records/18522323"
"18522308","18522308","done","True","C_7 Stress as a Diagnostic Primitive","10.5281/zenodo.18522308","10.5281/zenodo.18522307","https://doi.org/10.5281/zenodo.18522308","https://zenodo.org/records/18522308"
"18522292","18522292","done","True","A Meta Bookkeeping Regime for Theoretical Description","10.5281/zenodo.18522292","10.5281/zenodo.18522291","https://doi.org/10.5281/zenodo.18522292","https://zenodo.org/records/18522292"
"18522264","18522264","done","True","Governance-First Architecture for Artificial Intelligence (Quantum)","10.5281/zenodo.18522264","10.5281/zenodo.18522263","https://doi.org/10.5281/zenodo.18522264","https://zenodo.org/records/18522264"
"18522163","18522163","done","True","Constraint Bundle Transformations and Redescription Events","10.5281/zenodo.18522163","10.5281/zenodo.18522162","https://doi.org/10.5281/zenodo.18522163","https://zenodo.org/records/18522163"
"18522160","18522160","done","True","The Universe as an Admissible Interior","10.5281/zenodo.18522160","10.5281/zenodo.18522159","https://doi.org/10.5281/zenodo.18522160","https://zenodo.org/records/18522160"
"18522151","18522151","done","True","Agency as a Bookkeeping Projection","10.5281/zenodo.18522151","10.5281/zenodo.18522150","https://doi.org/10.5281/zenodo.18522151","https://zenodo.org/records/18522151"
"18522139","18522139","done","True","Admissible_Physical_Explanation","10.5281/zenodo.18522139","10.5281/zenodo.18522138","https://doi.org/10.5281/zenodo.18522139","https://zenodo.org/records/18522139"
"18522099","18522099","done","True","Realitas Clausa Per Exhaustionem","10.5281/zenodo.18522099","10.5281/zenodo.18522098","https://doi.org/10.5281/zenodo.18522099","https://zenodo.org/records/18522099"
"18522082","18522082","done","True","Adversarial Stress Test of the Central LA Theorem","10.5281/zenodo.18522082","10.5281/zenodo.18522081","https://doi.org/10.5281/zenodo.18522082","https://zenodo.org/records/18522082"
"18522070","18522070","done","True","Validation and Adversarial Closure of the Corpus","10.5281/zenodo.18522070","10.5281/zenodo.18522069","https://doi.org/10.5281/zenodo.18522070","https://zenodo.org/records/18522070"
"18522064","18522064","done","True","Three Forced v2 Lemmas Under the Expanded Boundary Regime","10.5281/zenodo.18522064","10.5281/zenodo.18522063","https://doi.org/10.5281/zenodo.18522064","https://zenodo.org/records/18522064"
"18522057","18522057","done","True","Adversarial Stress Test v2 Theorem Spine Under Expanded Boundary Regime","10.5281/zenodo.18522057","10.5281/zenodo.18522056","https://doi.org/10.5281/zenodo.18522057","https://zenodo.org/records/18522057"
"18522050","18522050","done","True","Nondegenerate Standing Forbids Infinite Footprint Multiplicity SND","10.5281/zenodo.18522050","10.5281/zenodo.18522049","https://doi.org/10.5281/zenodo.18522050","https://zenodo.org/records/18522050"
"18522007","18522007","done","True","The Singleton Meta-Necessity Theorem","10.5281/zenodo.18522007","10.5281/zenodo.18522006","https://doi.org/10.5281/zenodo.18522007","https://zenodo.org/records/18522007"
"18522001","18522001","done","True","Terminal Exclusion of Artificial Epistemic Agents Lacking Standing","10.5281/zenodo.18522001","10.5281/zenodo.18522000","https://doi.org/10.5281/zenodo.18522001","https://zenodo.org/records/18522001"
"18521991","18521991","done","True","Taxonomy of Artificial Standing Failure","10.5281/zenodo.18521991","10.5281/zenodo.18521990","https://doi.org/10.5281/zenodo.18521991","https://zenodo.org/records/18521991"
"18521979","18521979","done","True","Structural Necessity of Admissible Reality","10.5281/zenodo.18521979","10.5281/zenodo.18521978","https://doi.org/10.5281/zenodo.18521979","https://zenodo.org/records/18521979"
"18521964","18521964","done","True","Standing Requirement for Artificial Epistemic Agents","10.5281/zenodo.18521964","10.5281/zenodo.18521963","https://doi.org/10.5281/zenodo.18521964","https://zenodo.org/records/18521964"
"18521956","18521956","done","True","Standing Preserving Admissibility Conditions for Artificial Epistemic Agents","10.5281/zenodo.18521956","10.5281/zenodo.18521955","https://doi.org/10.5281/zenodo.18521956","https://zenodo.org/records/18521956"
"18521943","18521943","done","True","Standing Failure Non Repairability in Constraint Bundle Networks","10.5281/zenodo.18521943","10.5281/zenodo.18521942","https://doi.org/10.5281/zenodo.18521943","https://zenodo.org/records/18521943"
"18521938","18521938","done","True","Standing Failure Is Scope Global","10.5281/zenodo.18521938","10.5281/zenodo.18521937","https://doi.org/10.5281/zenodo.18521938","https://zenodo.org/records/18521938"
"18521932","18521932","done","True","Standing Conservation as an Equivalence Invariant","10.5281/zenodo.18521932","10.5281/zenodo.18521931","https://doi.org/10.5281/zenodo.18521932","https://zenodo.org/records/18521932"
"18521923","18521923","done","True","Standing Nondegeneracy and Closure Universalizer Exclusion","10.5281/zenodo.18521923","10.5281/zenodo.18521922","https://doi.org/10.5281/zenodo.18521923","https://zenodo.org/records/18521923"
"18521899","18521899","done","True","Restriction Reflection Is Strictly Stronger Than SND","10.5281/zenodo.18521899","10.5281/zenodo.18521898","https://doi.org/10.5281/zenodo.18521899","https://zenodo.org/records/18521899"
"18521890","18521890","done","True","Prohibition of Standing Preserving Admissibility Initiation","10.5281/zenodo.18521890","10.5281/zenodo.18521889","https://doi.org/10.5281/zenodo.18521890","https://zenodo.org/records/18521890"
"18521876","18521876","done","True","Prohibition of Standing Neutral Admissibility Regimes","10.5281/zenodo.18521876","10.5281/zenodo.18521875","https://doi.org/10.5281/zenodo.18521876","https://zenodo.org/records/18521876"
"18521869","18521869","done","True","Prohibition of Admissibility Reset Architectures","10.5281/zenodo.18521869","10.5281/zenodo.18521868","https://doi.org/10.5281/zenodo.18521869","https://zenodo.org/records/18521869"
"18521857","18521857","done","True","Physics as Interface Governed Representation","10.5281/zenodo.18521857","10.5281/zenodo.18521856","https://doi.org/10.5281/zenodo.18521857","https://zenodo.org/records/18521857"
"18521843","18521843","done","True","Non Explosion of Constraint Generated Reality","10.5281/zenodo.18521843","10.5281/zenodo.18521842","https://doi.org/10.5281/zenodo.18521843","https://zenodo.org/records/18521843"
"18521831","18521831","done","True","Non Collapse of Constraint Generated Reality","10.5281/zenodo.18521831","10.5281/zenodo.18521830","https://doi.org/10.5281/zenodo.18521831","https://zenodo.org/records/18521831"
"18521817","18521817","done","True","No Signaling as a Logical Corollary of Standing","10.5281/zenodo.18521817","10.5281/zenodo.18521816","https://doi.org/10.5281/zenodo.18521817","https://zenodo.org/records/18521817"
"18521811","18521811","done","True","No Ontic Flux Constraint An Interpretive Rule Under Conservation of Admissibility","10.5281/zenodo.18521811","10.5281/zenodo.18521810","https://doi.org/10.5281/zenodo.18521811","https://zenodo.org/records/18521811"
"18521801","18521801","done","True","Minimal Richness of Constraint Generated Reality","10.5281/zenodo.18521801","10.5281/zenodo.18521800","https://doi.org/10.5281/zenodo.18521801","https://zenodo.org/records/18521801"
"18521780","18521780","done","True","Meta Necessity of Admissibility with Arrow and Info Corollaries","10.5281/zenodo.18521780","10.5281/zenodo.18521779","https://doi.org/10.5281/zenodo.18521780","https://zenodo.org/records/18521780"
"18521769","18521769","done","True","Meta Necessity of Admissibility","10.5281/zenodo.18521769","10.5281/zenodo.18521768","https://doi.org/10.5281/zenodo.18521769","https://zenodo.org/records/18521769"
"18521767","18521767","done","True","Irreversibility of Network Level Standing Failure","10.5281/zenodo.18521767","10.5281/zenodo.18521766","https://doi.org/10.5281/zenodo.18521767","https://zenodo.org/records/18521767"
"18521756","18521756","done","True","Impossibility of Standing Recovery in Artificial Epistemic Agents","10.5281/zenodo.18521756","10.5281/zenodo.18521755","https://doi.org/10.5281/zenodo.18521756","https://zenodo.org/records/18521756"
"18521748","18521748","done","True","Global Enforcement of Admissibility","10.5281/zenodo.18521748","10.5281/zenodo.18521747","https://doi.org/10.5281/zenodo.18521748","https://zenodo.org/records/18521748"
"18521746","18521746","done","True","Existence_Fixed_Point_of_Constraint_Generated_Reality","10.5281/zenodo.18521746","10.5281/zenodo.18521745","https://doi.org/10.5281/zenodo.18521746","https://zenodo.org/records/18521746"
"18521736","18521736","done","True","Exhaustion_of_Non_Physical_Re_Anchoring_Strategies","10.5281/zenodo.18521736","10.5281/zenodo.18521735","https://doi.org/10.5281/zenodo.18521736","https://zenodo.org/records/18521736"
"18521734","18521734","done","True","Exhaustion of Admissibility Repair Strategies","10.5281/zenodo.18521734","10.5281/zenodo.18521733","https://doi.org/10.5281/zenodo.18521734","https://zenodo.org/records/18521734"
"18519315","18519315","done","True","Elimination by Closure When Foundational Constraints Do the Work","10.5281/zenodo.18519315","10.5281/zenodo.18519314","https://doi.org/10.5281/zenodo.18519315","https://zenodo.org/records/18519315"
"18519241","18519241","done","True","Eadem_Natura__Duo_Spectra","10.5281/zenodo.18519241","10.5281/zenodo.18519240","https://doi.org/10.5281/zenodo.18519241","https://zenodo.org/records/18519241"
"18519231","18519231","done","True","Constraint_Bundles__Taxonomy_and_Inseparability","10.5281/zenodo.18519231","10.5281/zenodo.18519230","https://doi.org/10.5281/zenodo.18519231","https://zenodo.org/records/18519231"
"18519223","18519223","done","True","Constraint Bundle Networks and Standing Failure Non Locality","10.5281/zenodo.18519223","10.5281/zenodo.18519222","https://doi.org/10.5281/zenodo.18519223","https://zenodo.org/records/18519223"
"18519206","18519206","done","True","Constraint Bundle Networks and Overlap Topology","10.5281/zenodo.18519206","10.5281/zenodo.18519205","https://doi.org/10.5281/zenodo.18519206","https://zenodo.org/records/18519206"
"18519194","18519194","done","True","Conservation_of_Admissibility_under_Redescription","10.5281/zenodo.18519194","10.5281/zenodo.18519193","https://doi.org/10.5281/zenodo.18519194","https://zenodo.org/records/18519194"
"18519183","18519183","done","True","Consequences of Artificial Standing Failure","10.5281/zenodo.18519183","10.5281/zenodo.18519182","https://doi.org/10.5281/zenodo.18519183","https://zenodo.org/records/18519183"
"18519166","18519166","done","True","Confluence as a Requirement for Reference Grounding","10.5281/zenodo.18519166","10.5281/zenodo.18519165","https://doi.org/10.5281/zenodo.18519166","https://zenodo.org/records/18519166"
"18519162","18519162","done","True","Closure_Requires_Exhaustion","10.5281/zenodo.18519162","10.5281/zenodo.18519161","https://doi.org/10.5281/zenodo.18519162","https://zenodo.org/records/18519162"
"18519150","18519150","done","True","ARC__3 Commitment Interaction and Propagation","10.5281/zenodo.18519150","10.5281/zenodo.18519149","https://doi.org/10.5281/zenodo.18519150","https://zenodo.org/records/18519150"
"18519135","18519135","done","True","Admissibility Without Nodes An Envelope First Formalism","10.5281/zenodo.18519135","10.5281/zenodo.18519134","https://doi.org/10.5281/zenodo.18519135","https://zenodo.org/records/18519135"
"18519114","18519114","done","True","Admissibility Is Scope Invariant","10.5281/zenodo.18519114","10.5281/zenodo.18519113","https://doi.org/10.5281/zenodo.18519114","https://zenodo.org/records/18519114"
"18519100","18519100","done","True","Admissibility and Standing in Artificial Epistemic Agents","10.5281/zenodo.18519100","10.5281/zenodo.18519099","https://doi.org/10.5281/zenodo.18519100","https://zenodo.org/records/18519100"
"18519002","18519002","done","True","α Ω The Admissible Interior as a Closed Structure","10.5281/zenodo.18519002","10.5281/zenodo.18519001","https://doi.org/10.5281/zenodo.18519002","https://zenodo.org/records/18519002"
"18518976","18518976","done","True","Universality as Closure Saturation","10.5281/zenodo.18518976","10.5281/zenodo.18518975","https://doi.org/10.5281/zenodo.18518976","https://zenodo.org/records/18518976"
"18518962","18518962","done","True","Model_Theoretic_Collapse","10.5281/zenodo.18518962","10.5281/zenodo.18518961","https://doi.org/10.5281/zenodo.18518962","https://zenodo.org/records/18518962"
"18518948","18518948","done","True","Closure Certificate CCC CLASS 001","10.5281/zenodo.18518948","10.5281/zenodo.18518947","https://doi.org/10.5281/zenodo.18518948","https://zenodo.org/records/18518948"
"18518928","18518928","done","True","Closure Certificates Forced Coincidence in Admissible Representational Regimes","10.5281/zenodo.18518928","10.5281/zenodo.18518927","https://doi.org/10.5281/zenodo.18518928","https://zenodo.org/records/18518928"
"18518893","18518893","done","True","Septem Sigilla Necessitatis On the Impossibility of Partial Closure","10.5281/zenodo.18518893","10.5281/zenodo.18518892","https://doi.org/10.5281/zenodo.18518893","https://zenodo.org/records/18518893"
"18518871","18518871","done","True","Unified Closure Certificate Cross Domain Admissibility Certified Closed by Exhaustion","10.5281/zenodo.18518871","10.5281/zenodo.18518870","https://doi.org/10.5281/zenodo.18518871","https://zenodo.org/records/18518871"
"18518853","18518853","done","True","Closure Certificate Admissible Physics Certified Closed by Exhaustion","10.5281/zenodo.18518853","10.5281/zenodo.18518852","https://doi.org/10.5281/zenodo.18518853","https://zenodo.org/records/18518853"
"18518842","18518842","done","True","Closure Certificate Admissible Mathematics Certified Closed by Exhaustion","10.5281/zenodo.18518842","10.5281/zenodo.18518841","https://doi.org/10.5281/zenodo.18518842","https://zenodo.org/records/18518842"
"18518826","18518826","done","True","Septem Sigilla The Seven Closures of Admissible Mathematics","10.5281/zenodo.18518826","10.5281/zenodo.18518825","https://doi.org/10.5281/zenodo.18518826","https://zenodo.org/records/18518826"
"18518813","18518813","done","True","Closure Certificate Reality Certified Closed by Exhaustion","10.5281/zenodo.18518813","10.5281/zenodo.18518812","https://doi.org/10.5281/zenodo.18518813","https://zenodo.org/records/18518813"
"18518795","18518795","done","True","Closure Certificate Septem Sigilla Certified Closed by Exhaustion","10.5281/zenodo.18518795","10.5281/zenodo.18518794","https://doi.org/10.5281/zenodo.18518795","https://zenodo.org/records/18518795"
"18518743","18518743","done","True","Septem Sigilla The Seven Closures","10.5281/zenodo.18518743","10.5281/zenodo.18518742","https://doi.org/10.5281/zenodo.18518743","https://zenodo.org/records/18518743"
"18518717","18518717","done","True","Unified Meta Closure of Admissibility Mathematics and Physics","10.5281/zenodo.18518717","10.5281/zenodo.18518716","https://doi.org/10.5281/zenodo.18518717","https://zenodo.org/records/18518717"
"18518693","18518693","done","True","Structural Exhaustion of the Admissibility Constraint Map","10.5281/zenodo.18518693","10.5281/zenodo.18518692","https://doi.org/10.5281/zenodo.18518693","https://zenodo.org/records/18518693"
"18518670","18518670","done","True","Standing Enforcement and Failure Admissibility Constraint Map Paper VI","10.5281/zenodo.18518670","10.5281/zenodo.18518669","https://doi.org/10.5281/zenodo.18518670","https://zenodo.org/records/18518670"
"18518649","18518649","done","True","Operator Composition and Sequencing Admissibility Constraint Map Paper V","10.5281/zenodo.18518649","10.5281/zenodo.18518648","https://doi.org/10.5281/zenodo.18518649","https://zenodo.org/records/18518649"
"18518624","18518624","done","True","Admissible Redescription Admissibility Constraint Map Paper IV","10.5281/zenodo.18518624","10.5281/zenodo.18518623","https://doi.org/10.5281/zenodo.18518624","https://zenodo.org/records/18518624"
"18518605","18518605","done","True","Operator Envelopes and Licences Admissibility Constraint Map Paper III","10.5281/zenodo.18518605","10.5281/zenodo.18518604","https://doi.org/10.5281/zenodo.18518605","https://zenodo.org/records/18518605"
"18518588","18518588","done","True","The AMetric Boundary Admissibility Constraint Map Paper II","10.5281/zenodo.18518588","10.5281/zenodo.18518587","https://doi.org/10.5281/zenodo.18518588","https://zenodo.org/records/18518588"
"18518573","18518573","done","True","Architectural Foundations Admissibility Constraint Map Paper I","10.5281/zenodo.18518573","10.5281/zenodo.18518572","https://doi.org/10.5281/zenodo.18518573","https://zenodo.org/records/18518573"
"18518528","18518528","done","True","Complementarity Without Duality","10.5281/zenodo.18518528","10.5281/zenodo.18518527","https://doi.org/10.5281/zenodo.18518528","https://zenodo.org/records/18518528"
"18518504","18518504","done","True","AI Epistemic Governance Admissibility and Standing in Artificial Reasoning Systems","10.5281/zenodo.18518504","10.5281/zenodo.18518503","https://doi.org/10.5281/zenodo.18518504","https://zenodo.org/records/18518504"
"18518474","18518474","done","True","Unified Consequence of CG Closed Physical Kernels","10.5281/zenodo.18518474","10.5281/zenodo.18518473","https://doi.org/10.5281/zenodo.18518474","https://zenodo.org/records/18518474"
"18518462","18518462","done","True","The Constraint Generator","10.5281/zenodo.18518462","10.5281/zenodo.18518461","https://doi.org/10.5281/zenodo.18518462","https://zenodo.org/records/18518462"
"18518442","18518442","done","True","Maximality and Non Extendability of Standing Preserving Bookkeeping Structures","10.5281/zenodo.18518442","10.5281/zenodo.18518441","https://doi.org/10.5281/zenodo.18518442","https://zenodo.org/records/18518442"
"18518405","18518405","done","True","Impossibility_of_Non_Cheating_Adversarial_Breaks","10.5281/zenodo.18518405","10.5281/zenodo.18518404","https://doi.org/10.5281/zenodo.18518405","https://zenodo.org/records/18518405"
"18518391","18518391","done","True","The Meta Invariance of Admissibility Criteria","10.5281/zenodo.18518391","10.5281/zenodo.18518390","https://doi.org/10.5281/zenodo.18518391","https://zenodo.org/records/18518391"
"18518374","18518374","done","True","Where Foundations Stop","10.5281/zenodo.18518374","10.5281/zenodo.18518373","https://doi.org/10.5281/zenodo.18518374","https://zenodo.org/records/18518374"
"18518349","18518349","done","True","The Impossibility of Deeper Invariants Under the AMetric Boundary","10.5281/zenodo.18518349","10.5281/zenodo.18518348","https://doi.org/10.5281/zenodo.18518349","https://zenodo.org/records/18518349"
"18518322","18518322","done","True","The Meta Necessity of Admissibility","10.5281/zenodo.18518322","10.5281/zenodo.18518321","https://doi.org/10.5281/zenodo.18518322","https://zenodo.org/records/18518322"
"18518305","18518305","done","True","The Necessity of Singleton Governance","10.5281/zenodo.18518305","10.5281/zenodo.18518304","https://doi.org/10.5281/zenodo.18518305","https://zenodo.org/records/18518305"
"18518286","18518286","done","True","FM_N_4 The Exhaustion of the Governance Repair Space","10.5281/zenodo.18518286","10.5281/zenodo.18518285","https://doi.org/10.5281/zenodo.18518286","https://zenodo.org/records/18518286"
"18518266","18518266","done","True","FM_N_3 The Necessity of Binary Standing","10.5281/zenodo.18518266","10.5281/zenodo.18518265","https://doi.org/10.5281/zenodo.18518266","https://zenodo.org/records/18518266"
"18518246","18518246","done","True","FM_N_2 The Impossibility of Governance Level Generalization","10.5281/zenodo.18518246","10.5281/zenodo.18518245","https://doi.org/10.5281/zenodo.18518246","https://zenodo.org/records/18518246"
"18518224","18518224","done","True","The Necessity of Definition Local Governance","10.5281/zenodo.18518224","10.5281/zenodo.18518223","https://doi.org/10.5281/zenodo.18518224","https://zenodo.org/records/18518224"
"18518209","18518209","done","True","The Necessity of Non Transmissive Recognition","10.5281/zenodo.18518209","10.5281/zenodo.18518208","https://doi.org/10.5281/zenodo.18518209","https://zenodo.org/records/18518209"
"18518189","18518189","done","True","The Singleton Theorem for Constraint Driven Engines","10.5281/zenodo.18518189","10.5281/zenodo.18518188","https://doi.org/10.5281/zenodo.18518189","https://zenodo.org/records/18518189"
"18518171","18518171","done","True","CE_11___Constraint_Driven_Engines_and_the_Replication_Illusion","10.5281/zenodo.18518171","10.5281/zenodo.18518170","https://doi.org/10.5281/zenodo.18518171","https://zenodo.org/records/18518171"
"18518158","18518158","done","True","CE_10 Constraint Envelopes and the Elimination of Nonlocal Causation Confusion","10.5281/zenodo.18518158","10.5281/zenodo.18518157","https://doi.org/10.5281/zenodo.18518158","https://zenodo.org/records/18518158"
"18518128","18518128","done","True","CE_9 Entanglement and Collapse as Internal Admissible Redescriptions","10.5281/zenodo.18518128","10.5281/zenodo.18518127","https://doi.org/10.5281/zenodo.18518128","https://zenodo.org/records/18518128"
"18518091","18518091","done","True","CE_8 Structural Underdetermination of Global Admissibility","10.5281/zenodo.18518091","10.5281/zenodo.18518090","https://doi.org/10.5281/zenodo.18518091","https://zenodo.org/records/18518091"
"18518079","18518079","done","True","CE_7 Constraint Envelopes Are Not Empirically Detectable","10.5281/zenodo.18518079","10.5281/zenodo.18518078","https://doi.org/10.5281/zenodo.18518079","https://zenodo.org/records/18518079"
"18518055","18518055","done","True","CE_6 The Impossibility of Constraint Envelope Interaction","10.5281/zenodo.18518055","10.5281/zenodo.18518052","https://doi.org/10.5281/zenodo.18518055","https://zenodo.org/records/18518055"
"18518022","18518022","done","True","CE_5 Admissible Redescription Under Envelope NonContact","10.5281/zenodo.18518022","10.5281/zenodo.18518021","https://doi.org/10.5281/zenodo.18518022","https://zenodo.org/records/18518022"
"18518009","18518009","done","True","CE_4 Admissibility Is Not Gradual","10.5281/zenodo.18518009","10.5281/zenodo.18518008","https://doi.org/10.5281/zenodo.18518009","https://zenodo.org/records/18518009"
"18517994","18517994","done","True","CE_3 Internal Admissibility Ordering Within a Constraint Envelope","10.5281/zenodo.18517994","10.5281/zenodo.18517993","https://doi.org/10.5281/zenodo.18517994","https://zenodo.org/records/18517994"
"18517970","18517970","done","True","CE_2 Fixation as Licensing Under Constraint Envelopes","10.5281/zenodo.18517970","10.5281/zenodo.18517969","https://doi.org/10.5281/zenodo.18517970","https://zenodo.org/records/18517970"
