"deposition_id","record_id","state","submitted","title","version_doi","concept_doi","doi_url","record_url"
"18517936","18517936","done","True","CE_1 Constraint Envelopes as Admissibility Structures","10.5281/zenodo.18517936","10.5281/zenodo.18517935","https://doi.org/10.5281/zenodo.18517936","https://zenodo.org/records/18517936"
"18517912","18517912","done","True","Admissibility Stared Back","10.5281/zenodo.18517912","10.5281/zenodo.18517911","https://doi.org/10.5281/zenodo.18517912","https://zenodo.org/records/18517912"
"18517182","18517182","done","True","Fixed Point Theorems as Standing Traps","10.5281/zenodo.18517182","10.5281/zenodo.18517181","https://doi.org/10.5281/zenodo.18517182","https://zenodo.org/records/18517182"
"18517151","18517151","done","True","D1 The Epistemic Firewall","10.5281/zenodo.18517151","10.5281/zenodo.18517150","https://doi.org/10.5281/zenodo.18517151","https://zenodo.org/records/18517151"
"18517139","18517139","done","True","D2 What Makes a Question Illicit","10.5281/zenodo.18517139","10.5281/zenodo.18517138","https://doi.org/10.5281/zenodo.18517139","https://zenodo.org/records/18517139"
"18517110","18517110","done","True","D3 Anchor Violation Question Classes","10.5281/zenodo.18517110","10.5281/zenodo.18517109","https://doi.org/10.5281/zenodo.18517110","https://zenodo.org/records/18517110"
"18517094","18517094","done","True","D4 Skin Reification and Tensor as History Errors","10.5281/zenodo.18517094","10.5281/zenodo.18517093","https://doi.org/10.5281/zenodo.18517094","https://zenodo.org/records/18517094"
"18517080","18517080","done","True","L1 Closure Taxonomy What Closure Is and Is Not","10.5281/zenodo.18517080","10.5281/zenodo.18517079","https://doi.org/10.5281/zenodo.18517080","https://zenodo.org/records/18517080"
"18517058","18517058","done","True","L2 The Unclosable Contingent Reality","10.5281/zenodo.18517058","10.5281/zenodo.18517057","https://doi.org/10.5281/zenodo.18517058","https://zenodo.org/records/18517058"
"18517022","18517022","done","True","L3 The Perpetually Open Measurement Class Uncertainty","10.5281/zenodo.18517022","10.5281/zenodo.18517021","https://doi.org/10.5281/zenodo.18517022","https://zenodo.org/records/18517022"
"18516995","18516995","done","True","Tensor as Rule The Mathematics of Standing Preserving Redescription","10.5281/zenodo.18516995","10.5281/zenodo.18516994","https://doi.org/10.5281/zenodo.18516995","https://zenodo.org/records/18516995"
"18516965","18516965","done","True","B1 Replacement Mathematics Is Impossible Closure by Exhaustion","10.5281/zenodo.18516965","10.5281/zenodo.18516964","https://doi.org/10.5281/zenodo.18516965","https://zenodo.org/records/18516965"
"18516916","18516916","done","True","B2 Tensor Calculus Is Not a Replacement Structure","10.5281/zenodo.18516916","10.5281/zenodo.18516915","https://doi.org/10.5281/zenodo.18516916","https://zenodo.org/records/18516916"
"18516895","18516895","done","True","B3 Admissibility Dynamics Is Impossible","10.5281/zenodo.18516895","10.5281/zenodo.18516894","https://doi.org/10.5281/zenodo.18516895","https://zenodo.org/records/18516895"
"18516865","18516865","done","True","B4 Admissibility Metrics Are Impossible","10.5281/zenodo.18516865","10.5281/zenodo.18516864","https://doi.org/10.5281/zenodo.18516865","https://zenodo.org/records/18516865"
"18516851","18516851","done","True","B5 Meta Mathematics as Replacement Is Impossible","10.5281/zenodo.18516851","10.5281/zenodo.18516850","https://doi.org/10.5281/zenodo.18516851","https://zenodo.org/records/18516851"
"18516826","18516826","done","True","B6 Admissibility Semantics Are Impossible","10.5281/zenodo.18516826","10.5281/zenodo.18516825","https://doi.org/10.5281/zenodo.18516826","https://zenodo.org/records/18516826"
"18516815","18516815","done","True","B7 Governance Level Repair Is Impossible","10.5281/zenodo.18516815","10.5281/zenodo.18516814","https://doi.org/10.5281/zenodo.18516815","https://zenodo.org/records/18516815"
"18516790","18516790","done","True","B8 Authority Based Legitimacy Is Impossible","10.5281/zenodo.18516790","10.5281/zenodo.18516789","https://doi.org/10.5281/zenodo.18516790","https://zenodo.org/records/18516790"
"18516758","18516758","done","True","B9 Post Hoc Justification Is Impossible","10.5281/zenodo.18516758","10.5281/zenodo.18516757","https://doi.org/10.5281/zenodo.18516758","https://zenodo.org/records/18516758"
"18516739","18516739","done","True","B10 Consensus Based Legitimacy Is Impossible","10.5281/zenodo.18516739","10.5281/zenodo.18516738","https://doi.org/10.5281/zenodo.18516739","https://zenodo.org/records/18516739"
"18516724","18516724","done","True","B11 Ethical Normative Legitimacy Is Impossible","10.5281/zenodo.18516724","10.5281/zenodo.18516723","https://doi.org/10.5281/zenodo.18516724","https://zenodo.org/records/18516724"
"18516716","18516716","done","True","Irreducible Openness Is Not Incompleteness","10.5281/zenodo.18516716","10.5281/zenodo.18516715","https://doi.org/10.5281/zenodo.18516716","https://zenodo.org/records/18516716"
"18516703","18516703","done","True","Equivalence as Absence of Admissible Witness","10.5281/zenodo.18516703","10.5281/zenodo.18516702","https://doi.org/10.5281/zenodo.18516703","https://zenodo.org/records/18516703"
"18516683","18516683","done","True","L2_3 Scale and Normalization Collapse","10.5281/zenodo.18516683","10.5281/zenodo.18516682","https://doi.org/10.5281/zenodo.18516683","https://zenodo.org/records/18516683"
"18516661","18516661","done","True","L2_2 Discrete Label Collapse","10.5281/zenodo.18516661","10.5281/zenodo.18516660","https://doi.org/10.5281/zenodo.18516661","https://zenodo.org/records/18516661"
"18516654","18516654","done","True","L2_4__Basis_and_Gauge_Parameter_Collapse","10.5281/zenodo.18516654","10.5281/zenodo.18516653","https://doi.org/10.5281/zenodo.18516654","https://zenodo.org/records/18516654"
"18516648","18516648","done","True","L2_5 Renormalization and Scheme Parameter Collapse","10.5281/zenodo.18516648","10.5281/zenodo.18516647","https://doi.org/10.5281/zenodo.18516648","https://zenodo.org/records/18516648"
"18516630","18516630","done","True","L2_6 Redundancy Survivor Elimination","10.5281/zenodo.18516630","10.5281/zenodo.18516629","https://doi.org/10.5281/zenodo.18516630","https://zenodo.org/records/18516630"
"18516616","18516616","done","True","L2_7 Closure Induced Uniqueness","10.5281/zenodo.18516616","10.5281/zenodo.18516615","https://doi.org/10.5281/zenodo.18516616","https://zenodo.org/records/18516616"
"18516604","18516604","done","True","L2_8 No Free Parameter Theorems","10.5281/zenodo.18516604","10.5281/zenodo.18516603","https://doi.org/10.5281/zenodo.18516604","https://zenodo.org/records/18516604"
"18516594","18516594","done","True","L2_1 Continuous Parameter Collapse","10.5281/zenodo.18516594","10.5281/zenodo.18516593","https://doi.org/10.5281/zenodo.18516594","https://zenodo.org/records/18516594"
"18516576","18516576","done","True","L3_1 Constraint Mutual Dependence","10.5281/zenodo.18516576","10.5281/zenodo.18516575","https://doi.org/10.5281/zenodo.18516576","https://zenodo.org/records/18516576"
"18516558","18516558","done","True","L3_2 Overdetermination Proofs","10.5281/zenodo.18516558","10.5281/zenodo.18516557","https://doi.org/10.5281/zenodo.18516558","https://zenodo.org/records/18516558"
"18516547","18516547","done","True","L3_3 Constraint Redundancy without Freedom","10.5281/zenodo.18516547","10.5281/zenodo.18516546","https://doi.org/10.5281/zenodo.18516547","https://zenodo.org/records/18516547"
"18516527","18516527","done","True","L3_4 Removal Induced Collapse","10.5281/zenodo.18516527","10.5281/zenodo.18516526","https://doi.org/10.5281/zenodo.18516527","https://zenodo.org/records/18516527"
"18516493","18516493","done","True","L3_5 No Minimal Subset Theorems","10.5281/zenodo.18516493","10.5281/zenodo.18516492","https://doi.org/10.5281/zenodo.18516493","https://zenodo.org/records/18516493"
"18516484","18516484","done","True","L3_6___Global_Consistency_Lock","10.5281/zenodo.18516484","10.5281/zenodo.18516483","https://doi.org/10.5281/zenodo.18516484","https://zenodo.org/records/18516484"
"18516464","18516464","done","True","L3_7 Admissible Interior Rigidity","10.5281/zenodo.18516464","10.5281/zenodo.18516463","https://doi.org/10.5281/zenodo.18516464","https://zenodo.org/records/18516464"
"18516443","18516443","done","True","L3_8 No Relaxation Corollaries","10.5281/zenodo.18516443","10.5281/zenodo.18516442","https://doi.org/10.5281/zenodo.18516443","https://zenodo.org/records/18516443"
"18516425","18516425","done","True","L3 Constraint Saturation of the Admissible Interior","10.5281/zenodo.18516425","10.5281/zenodo.18516424","https://doi.org/10.5281/zenodo.18516425","https://zenodo.org/records/18516425"
"18516403","18516403","done","True","L4 Rigidity Under Standing","10.5281/zenodo.18516403","10.5281/zenodo.18516402","https://doi.org/10.5281/zenodo.18516403","https://zenodo.org/records/18516403"
"18516384","18516384","done","True","L5 Nonlocal Conservation Coupling Under Standing","10.5281/zenodo.18516384","10.5281/zenodo.18516383","https://doi.org/10.5281/zenodo.18516384","https://zenodo.org/records/18516384"
"18516357","18516357","done","True","L7 Redescription Rigidity Role Preservation","10.5281/zenodo.18516357","10.5281/zenodo.18516356","https://doi.org/10.5281/zenodo.18516357","https://zenodo.org/records/18516357"
"18516328","18516328","done","True","L8 Closure Induced Uniqueness of the Admissible Structure","10.5281/zenodo.18516328","10.5281/zenodo.18516327","https://doi.org/10.5281/zenodo.18516328","https://zenodo.org/records/18516328"
"18515634","18515634","done","True","Special Relativity as Standing Preserving Kinematic Bookkeeping","10.5281/zenodo.18515634","10.5281/zenodo.18515633","https://doi.org/10.5281/zenodo.18515634","https://zenodo.org/records/18515634"
"18515618","18515618","done","True","Transport Closure Locus for Continuous Parameters","10.5281/zenodo.18515618","10.5281/zenodo.18515617","https://doi.org/10.5281/zenodo.18515618","https://zenodo.org/records/18515618"
"18515599","18515599","done","True","Generation Multiplicity Minimality and Non Degeneracy","10.5281/zenodo.18515599","10.5281/zenodo.18515598","https://doi.org/10.5281/zenodo.18515599","https://zenodo.org/records/18515599"
"18515581","18515581","done","True","The Standard Model as the Unique Minimal Standing Preserving Bookkeeping Structure","10.5281/zenodo.18515581","10.5281/zenodo.18515580","https://doi.org/10.5281/zenodo.18515581","https://zenodo.org/records/18515581"
"18515532","18515532","done","True","Quantum Mechanics as CG Closed Redescription Bookkeeping","10.5281/zenodo.18515532","10.5281/zenodo.18515531","https://doi.org/10.5281/zenodo.18515532","https://zenodo.org/records/18515532"
"18515481","18515481","done","True","Identity Non Conservation","10.5281/zenodo.18515481","10.5281/zenodo.18515480","https://doi.org/10.5281/zenodo.18515481","https://zenodo.org/records/18515481"
"18515460","18515460","done","True","Admissible Identity Drift in the Standard model","10.5281/zenodo.18515460","10.5281/zenodo.18515459","https://doi.org/10.5281/zenodo.18515460","https://zenodo.org/records/18515460"
"18515438","18515438","done","True","Standing Localization and the Structural Inevitability of Life","10.5281/zenodo.18515438","10.5281/zenodo.18515437","https://doi.org/10.5281/zenodo.18515438","https://zenodo.org/records/18515438"
"18515426","18515426","done","True","End of the Admissible Interior","10.5281/zenodo.18515426","10.5281/zenodo.18515425","https://doi.org/10.5281/zenodo.18515426","https://zenodo.org/records/18515426"
"18515410","18515410","done","True","Beginning of the Admissible Interior","10.5281/zenodo.18515410","10.5281/zenodo.18515409","https://doi.org/10.5281/zenodo.18515410","https://zenodo.org/records/18515410"
"18515397","18515397","done","True","L1 Paper 1 Equivalence Completion and Forced Collapse of Charged Current","10.5281/zenodo.18515397","10.5281/zenodo.18515396","https://doi.org/10.5281/zenodo.18515397","https://zenodo.org/records/18515397"
"18515369","18515369","done","True","L1 Paper 2 Equivalence Completion in the QCD CP Odd Sector","10.5281/zenodo.18515369","10.5281/zenodo.18515368","https://doi.org/10.5281/zenodo.18515369","https://zenodo.org/records/18515369"
"18515343","18515343","done","True","L1 Paper 3 Fermion Yukawa Mass Equivalence","10.5281/zenodo.18515343","10.5281/zenodo.18515342","https://doi.org/10.5281/zenodo.18515343","https://zenodo.org/records/18515343"
"18515319","18515319","done","True","L1 Paper 4 EW QED EM coupling collapse","10.5281/zenodo.18515319","10.5281/zenodo.18515318","https://doi.org/10.5281/zenodo.18515319","https://zenodo.org/records/18515319"
"18515296","18515296","done","True","L1 Paper 5 Neutrino mixing invariants","10.5281/zenodo.18515296","10.5281/zenodo.18515295","https://doi.org/10.5281/zenodo.18515296","https://zenodo.org/records/18515296"
"18515276","18515276","done","True","L1 Paper 6 Longitudinal Goldstone Equivalence","10.5281/zenodo.18515276","10.5281/zenodo.18515275","https://doi.org/10.5281/zenodo.18515276","https://zenodo.org/records/18515276"
"18515153","18515153","done","True","L1 Paper 12 Exhaustion and Closure of the Equivalence Space","10.5281/zenodo.18515153","10.5281/zenodo.18515152","https://doi.org/10.5281/zenodo.18515153","https://zenodo.org/records/18515153"
"18515134","18515134","done","True","Why Chiral Asymmetry Is Not Optional","10.5281/zenodo.18515134","10.5281/zenodo.18515133","https://doi.org/10.5281/zenodo.18515134","https://zenodo.org/records/18515134"
"18515009","18515009","done","True","Why Reference Must Be Fixed Semantic Infrastructure as a Condition of Empirical Theory","10.5281/zenodo.18515009","10.5281/zenodo.18515008","https://doi.org/10.5281/zenodo.18515009","https://zenodo.org/records/18515009"
"18514997","18514997","done","True","From Provability to Confirmation Gödel Style Limits on Empirical Truth","10.5281/zenodo.18514997","10.5281/zenodo.18514996","https://doi.org/10.5281/zenodo.18514997","https://zenodo.org/records/18514997"
"18514971","18514971","done","True","GR QT Well Posedness","10.5281/zenodo.18514971","10.5281/zenodo.18514970","https://doi.org/10.5281/zenodo.18514971","https://zenodo.org/records/18514971"
"18514943","18514943","done","True","Physics Under Admissibility Asymmetric Lorentz Compatibility","10.5281/zenodo.18514943","10.5281/zenodo.18514942","https://doi.org/10.5281/zenodo.18514943","https://zenodo.org/records/18514943"
"18514908","18514908","done","True","On the Completeness of Standing Failure","10.5281/zenodo.18514908","10.5281/zenodo.18514907","https://doi.org/10.5281/zenodo.18514908","https://zenodo.org/records/18514908"
"18514880","18514880","done","True","Standing as Dischargeable Referential Capacity","10.5281/zenodo.18514880","10.5281/zenodo.18514879","https://doi.org/10.5281/zenodo.18514880","https://zenodo.org/records/18514880"
"18514859","18514859","done","True","Empirical Intelligibility in Physically Non Selective Theories","10.5281/zenodo.18514859","10.5281/zenodo.18514858","https://doi.org/10.5281/zenodo.18514859","https://zenodo.org/records/18514859"
"18514835","18514835","done","True","Admissibility as the Boundary Between Physics and Metaphysics","10.5281/zenodo.18514835","10.5281/zenodo.18514834","https://doi.org/10.5281/zenodo.18514835","https://zenodo.org/records/18514835"
"18514804","18514804","done","True","Empirical Admissibility and the Conditions of Confirmational Reference","10.5281/zenodo.18514804","10.5281/zenodo.18514803","https://doi.org/10.5281/zenodo.18514804","https://zenodo.org/records/18514804"
"18514792","18514792","done","True","Repairing Confirmation A Structural Classification","10.5281/zenodo.18514792","10.5281/zenodo.18514791","https://doi.org/10.5281/zenodo.18514792","https://zenodo.org/records/18514792"
"18514775","18514775","done","True","Standing Conservation and the Impossibility of Ontic Unintelligibility","10.5281/zenodo.18514775","10.5281/zenodo.18514774","https://doi.org/10.5281/zenodo.18514775","https://zenodo.org/records/18514775"
"18514743","18514743","done","True","Time as Standing Indexed Order A Derived Structure Account Under Admissibility","10.5281/zenodo.18514743","10.5281/zenodo.18514742","https://doi.org/10.5281/zenodo.18514743","https://zenodo.org/records/18514743"
"18514713","18514713","done","True","Ontic Richness Without Degrees of Freedom","10.5281/zenodo.18514713","10.5281/zenodo.18514712","https://doi.org/10.5281/zenodo.18514713","https://zenodo.org/records/18514713"
"18514690","18514690","done","True","Degrees_of_Expressive_Freedom","10.5281/zenodo.18514690","10.5281/zenodo.18514689","https://doi.org/10.5281/zenodo.18514690","https://zenodo.org/records/18514690"
"18514668","18514668","done","True","Envelope Relative Comparability of Expressive Richness","10.5281/zenodo.18514668","10.5281/zenodo.18514667","https://doi.org/10.5281/zenodo.18514668","https://zenodo.org/records/18514668"
"18514635","18514635","done","True","Wigners Friend as Illicit Scope Transport","10.5281/zenodo.18514635","10.5281/zenodo.18514634","https://doi.org/10.5281/zenodo.18514635","https://zenodo.org/records/18514635"
"18514628","18514628","done","True","ARC-1 Free Will as Admissible Commitment","10.5281/zenodo.18514628","10.5281/zenodo.18514627","https://doi.org/10.5281/zenodo.18514628","https://zenodo.org/records/18514628"
"18514602","18514602","done","True","Probability as Standing Preserving Bookkeeping large Objection Elimination_and_Structural_Derivation","10.5281/zenodo.18514602","10.5281/zenodo.18514601","https://doi.org/10.5281/zenodo.18514602","https://zenodo.org/records/18514602"
"18514590","18514590","done","True","Statistics and Inference as Standing Preserving Bookkeeping","10.5281/zenodo.18514590","10.5281/zenodo.18514589","https://doi.org/10.5281/zenodo.18514590","https://zenodo.org/records/18514590"
"18514585","18514585","done","True","Statistical Mechanics as Standing Preserving Bookkeeping","10.5281/zenodo.18514585","10.5281/zenodo.18514584","https://doi.org/10.5281/zenodo.18514585","https://zenodo.org/records/18514585"
"18514566","18514566","done","True","Econometrics and Regression as Standing Preserving Bookkeeping","10.5281/zenodo.18514566","10.5281/zenodo.18514565","https://doi.org/10.5281/zenodo.18514566","https://zenodo.org/records/18514566"
"18514552","18514552","done","True","Identity and Phase Admissibility","10.5281/zenodo.18514552","10.5281/zenodo.18514551","https://doi.org/10.5281/zenodo.18514552","https://zenodo.org/records/18514552"
"18514545","18514545","done","True","General Relativity and Quantum Mechanics as Bookkeeping Projection Regimes","10.5281/zenodo.18514545","10.5281/zenodo.18514544","https://doi.org/10.5281/zenodo.18514545","https://zenodo.org/records/18514545"
"18514423","18514423","done","True","The Impossibility of Internal Confirmational Sufficiency","10.5281/zenodo.18514423","10.5281/zenodo.18514422","https://doi.org/10.5281/zenodo.18514423","https://zenodo.org/records/18514423"
"18514407","18514407","done","True","No Structure Free Aggregation of Reference Dependent Confirmation","10.5281/zenodo.18514407","10.5281/zenodo.18514406","https://doi.org/10.5281/zenodo.18514407","https://zenodo.org/records/18514407"
"18514393","18514393","done","True","Admissibility Violations as Predictors of Scientific Pathology","10.5281/zenodo.18514393","10.5281/zenodo.18514392","https://doi.org/10.5281/zenodo.18514393","https://zenodo.org/records/18514393"
"18514380","18514380","done","True","Admissibility vs Typicality Why Measure Arguments Are Secondary","10.5281/zenodo.18514380","10.5281/zenodo.18514379","https://doi.org/10.5281/zenodo.18514380","https://zenodo.org/records/18514380"
"18514365","18514365","done","True","Why Perfect Isotropy Is Epistemically Illicit","10.5281/zenodo.18514365","10.5281/zenodo.18514364","https://doi.org/10.5281/zenodo.18514365","https://zenodo.org/records/18514365"
"18514352","18514352","done","True","Why No Gravitational Charge Exists","10.5281/zenodo.18514352","10.5281/zenodo.18514351","https://doi.org/10.5281/zenodo.18514352","https://zenodo.org/records/18514352"
"18514328","18514328","done","True","Why Gravity Is Not Actuatable Elimination by Standing Closure","10.5281/zenodo.18514328","10.5281/zenodo.18514327","https://doi.org/10.5281/zenodo.18514328","https://zenodo.org/records/18514328"
"18514319","18514319","done","True","Explicit Domain Closures","10.5281/zenodo.18514319","10.5281/zenodo.18514318","https://doi.org/10.5281/zenodo.18514319","https://zenodo.org/records/18514319"
"18514298","18514298","done","True","No Deferred Admissibility","10.5281/zenodo.18514298","10.5281/zenodo.18514297","https://doi.org/10.5281/zenodo.18514298","https://zenodo.org/records/18514298"
"18514283","18514283","done","True","Prohibition of Silent Redescription","10.5281/zenodo.18514283","10.5281/zenodo.18514282","https://doi.org/10.5281/zenodo.18514283","https://zenodo.org/records/18514283"
"18514271","18514271","done","True","Non Factorizability of Admissibility","10.5281/zenodo.18514271","10.5281/zenodo.18514270","https://doi.org/10.5281/zenodo.18514271","https://zenodo.org/records/18514271"
"18514256","18514256","done","True","Non Locality of Standing Failure","10.5281/zenodo.18514256","10.5281/zenodo.18514255","https://doi.org/10.5281/zenodo.18514256","https://zenodo.org/records/18514256"
"18514235","18514235","done","True","No Post Selection Repair","10.5281/zenodo.18514235","10.5281/zenodo.18514234","https://doi.org/10.5281/zenodo.18514235","https://zenodo.org/records/18514235"
"18514211","18514211","done","True","Richness Collapse Under Admissible Restriction","10.5281/zenodo.18514211","10.5281/zenodo.18514210","https://doi.org/10.5281/zenodo.18514211","https://zenodo.org/records/18514211"
"18514188","18514188","done","True","The Standard Model Is Not Fundamental","10.5281/zenodo.18514188","10.5281/zenodo.18514187","https://doi.org/10.5281/zenodo.18514188","https://zenodo.org/records/18514188"
"18514170","18514170","done","True","Exiting the Standard Model Admissible Interior","10.5281/zenodo.18514170","10.5281/zenodo.18514169","https://doi.org/10.5281/zenodo.18514170","https://zenodo.org/records/18514170"
"18514130","18514130","done","True","Why the Standard Model Cannot Explain Its Own Parameters","10.5281/zenodo.18514130","10.5281/zenodo.18514129","https://doi.org/10.5281/zenodo.18514130","https://zenodo.org/records/18514130"
"18514098","18514098","done","True","AA__1 Standing and Identity of Artificial Agents","10.5281/zenodo.18514098","10.5281/zenodo.18514097","https://doi.org/10.5281/zenodo.18514098","https://zenodo.org/records/18514098"
"18514084","18514084","done","True","AA_2 Scope Bound Learning and Illicit Generalization","10.5281/zenodo.18514084","10.5281/zenodo.18514083","https://doi.org/10.5281/zenodo.18514084","https://zenodo.org/records/18514084"
"18514069","18514069","done","True","AA_3 Self Modification Redescription and Standing Collapse","10.5281/zenodo.18514069","10.5281/zenodo.18514068","https://doi.org/10.5281/zenodo.18514069","https://zenodo.org/records/18514069"
"18514052","18514052","done","True","AA_4 Persistence Update and the Impossibility of Standing Preserving Continuity","10.5281/zenodo.18514052","10.5281/zenodo.18514051","https://doi.org/10.5281/zenodo.18514052","https://zenodo.org/records/18514052"
"18514033","18514033","done","True","AA_5 Instantiation Replacement and the Non Equivalence of Successive Artificial Agents","10.5281/zenodo.18514033","10.5281/zenodo.18514032","https://doi.org/10.5281/zenodo.18514033","https://zenodo.org/records/18514033"
"18514014","18514014","done","True","AA_6 Delegation Authorization and the Impossibility of Standing Preserving Proxy Agents","10.5281/zenodo.18514014","10.5281/zenodo.18514013","https://doi.org/10.5281/zenodo.18514014","https://zenodo.org/records/18514014"
"18513986","18513986","done","True","AA_7 Collective Systems Orchestration and the Impossibility of Standing Compositional Artificial Agents","10.5281/zenodo.18513986","10.5281/zenodo.18513985","https://doi.org/10.5281/zenodo.18513986","https://zenodo.org/records/18513986"
"18513968","18513968","done","True","AA_8 Markets Training Collectives and the Impossibility of Standing via Model Ecosystems","10.5281/zenodo.18513968","10.5281/zenodo.18513967","https://doi.org/10.5281/zenodo.18513968","https://zenodo.org/records/18513968"
"18513950","18513950","done","True","AA_9 Simulation Worlds Benchmarks and the Impossibility of Standing via Evaluation Environments","10.5281/zenodo.18513950","10.5281/zenodo.18513949","https://doi.org/10.5281/zenodo.18513950","https://zenodo.org/records/18513950"
"18513929","18513929","done","True","AA_T The Impossibility of Standing Bearing Artificial Agents","10.5281/zenodo.18513929","10.5281/zenodo.18513928","https://doi.org/10.5281/zenodo.18513929","https://zenodo.org/records/18513929"
"18513921","18513921","done","True","AA-CT 1 Governance Status of Artificial Agents Under Standing and Admissibility","10.5281/zenodo.18513921","10.5281/zenodo.18513920","https://doi.org/10.5281/zenodo.18513921","https://zenodo.org/records/18513921"
"18513896","18513896","done","True","AA_CT_3 Refusal Termination and Non Continuity in Artificial Agent Governance","10.5281/zenodo.18513896","10.5281/zenodo.18513895","https://doi.org/10.5281/zenodo.18513896","https://zenodo.org/records/18513896"
"18513878","18513878","done","True","Strong CP as Illicit Phase Realism","10.5281/zenodo.18513878","10.5281/zenodo.18513877","https://doi.org/10.5281/zenodo.18513878","https://zenodo.org/records/18513878"
"18493003","18493003","done","True","Standing Preserving Coupling Theorem SPCT","10.5281/zenodo.18493003","10.5281/zenodo.18493002","https://doi.org/10.5281/zenodo.18493003","https://zenodo.org/records/18493003"
