"deposition_id","record_id","state","submitted","title","version_doi","concept_doi","doi_url","record_url"
"18603440","18603440","done","True","Dimensionless Gauge Couplings as Moduli","10.5281/zenodo.18603440","10.5281/zenodo.18603439","https://doi.org/10.5281/zenodo.18603440","https://zenodo.org/records/18603440"
"18602733","18602733","done","True","The Meissner Effect as a Phase Defining Constraint","10.5281/zenodo.18602733","10.5281/zenodo.18602732","https://doi.org/10.5281/zenodo.18602733","https://zenodo.org/records/18602733"
"18591484","18591484","done","True","Forced Coincidence Under Admissible Overlap (Euler's identity,Fundamental Theorem of Algebra, the Gauss–Bonnet theorem, and Noether's theorem)","10.5281/zenodo.18591484","10.5281/zenodo.18591483","https://doi.org/10.5281/zenodo.18591484","https://zenodo.org/records/18591484"
"18589697","18589697","done","True","The Riemann Hypothesis as a Standing Fixation Constraint","10.5281/zenodo.18589697","10.5281/zenodo.18589108","https://doi.org/10.5281/zenodo.18589697","https://zenodo.org/records/18589697"
"18587159","18587159","done","True","Standing Localization and the Structural Inevitability of Life (standalone version)","10.5281/zenodo.18587159","10.5281/zenodo.18587158","https://doi.org/10.5281/zenodo.18587159","https://zenodo.org/records/18587159"
"18584224","18584224","done","True","On the Structural Necessity of pi from Closed Rotational Invariance","10.5281/zenodo.18584224","10.5281/zenodo.18584223","https://doi.org/10.5281/zenodo.18584224","https://zenodo.org/records/18584224"
"18545490","18545490","done","True","The Standard Model is not derived but forced by admissibility constraints","10.5281/zenodo.18545490","10.5281/zenodo.18545489","https://doi.org/10.5281/zenodo.18545490","https://zenodo.org/records/18545490"
"18543350","18543350","done","True","L1 Paper 11 Hypercharge Normalization Electric Charge Quantization","10.5281/zenodo.18543350","10.5281/zenodo.18515176","https://doi.org/10.5281/zenodo.18543350","https://zenodo.org/records/18543350"
"18543209","18543209","done","True","L1 Paper 10 Absence of Tree Level Flavor Changing Neutral Currents","10.5281/zenodo.18543209","10.5281/zenodo.18515196","https://doi.org/10.5281/zenodo.18543209","https://zenodo.org/records/18543209"
"18542947","18542947","done","True","L1 Paper 9 Rephasing Redundancy Exhaustion","10.5281/zenodo.18542947","10.5281/zenodo.18515214","https://doi.org/10.5281/zenodo.18542947","https://zenodo.org/records/18542947"
"18542702","18542702","done","True","L1 Paper 8 Unitary Mixing Saturation","10.5281/zenodo.18542702","10.5281/zenodo.18515229","https://doi.org/10.5281/zenodo.18542702","https://zenodo.org/records/18542702"
"18542656","18542656","done","True","L1 Paper 7 Yukawa Realizability under Minimal Chiral Load","10.5281/zenodo.18542656","10.5281/zenodo.18515249","https://doi.org/10.5281/zenodo.18542656","https://zenodo.org/records/18542656"
"18531800","18531800","done","True","ADMISSIBILITY PRECEDES THEORY","10.5281/zenodo.18531800","10.5281/zenodo.18513502","https://doi.org/10.5281/zenodo.18531800","https://zenodo.org/records/18531800"
"18531711","18531711","done","True","Admissibility Standing and the Elimination of Epistemic Surrogates","10.5281/zenodo.18531711","10.5281/zenodo.18513526","https://doi.org/10.5281/zenodo.18531711","https://zenodo.org/records/18531711"
"18531596","18531596","done","True","Claim Modality and the Structure of Assertion","10.5281/zenodo.18531596","10.5281/zenodo.18513542","https://doi.org/10.5281/zenodo.18531596","https://zenodo.org/records/18531596"
"18531515","18531515","done","True","WHY NO EMPIRICAL RESULT CAN REFUTE LORENTZIAN ADMISSIBILITY","10.5281/zenodo.18531515","10.5281/zenodo.18513474","https://doi.org/10.5281/zenodo.18531515","https://zenodo.org/records/18531515"
"18531291","18531291","done","True","Fixation as a Non Optional Structural Constraint","10.5281/zenodo.18531291","10.5281/zenodo.18513447","https://doi.org/10.5281/zenodo.18531291","https://zenodo.org/records/18531291"
"18531133","18531133","done","True","Admissible Reference Fixation as a Necessary Condition for Theory Level Empirical Confirmation","10.5281/zenodo.18531133","10.5281/zenodo.18513385","https://doi.org/10.5281/zenodo.18531133","https://zenodo.org/records/18531133"
"18531054","18531054","done","True","Lorentzian Admissibility","10.5281/zenodo.18531054","10.5281/zenodo.18513418","https://doi.org/10.5281/zenodo.18531054","https://zenodo.org/records/18531054"
"18530949","18530949","done","True","Empirical Completeness and Reference Robust Confirmation The Maley Theorem","10.5281/zenodo.18530949","10.5281/zenodo.18513332","https://doi.org/10.5281/zenodo.18530949","https://zenodo.org/records/18530949"
"18525471","18525471","done","True","Paper B4 Regime Transitions Without Dynamics","10.5281/zenodo.18525471","10.5281/zenodo.18525470","https://doi.org/10.5281/zenodo.18525471","https://zenodo.org/records/18525471"
"18525456","18525456","done","True","Paper B3 Physical Theories Reclassified as Stability Classes","10.5281/zenodo.18525456","10.5281/zenodo.18525455","https://doi.org/10.5281/zenodo.18525456","https://zenodo.org/records/18525456"
"18525438","18525438","done","True","Paper_B2 Stable Metastable and Impossible Regimes","10.5281/zenodo.18525438","10.5281/zenodo.18525437","https://doi.org/10.5281/zenodo.18525438","https://zenodo.org/records/18525438"
"18525423","18525423","done","True","Paper_B1 Constraint Bonding and Regime Formation","10.5281/zenodo.18525423","10.5281/zenodo.18525422","https://doi.org/10.5281/zenodo.18525423","https://zenodo.org/records/18525423"
"18525385","18525385","done","True","L7 The Open World Theorem for Inquiry the Arc L capstone","10.5281/zenodo.18525385","10.5281/zenodo.18525384","https://doi.org/10.5281/zenodo.18525385","https://zenodo.org/records/18525385"
"18525350","18525350","done","True","L6 Structural Novelty III New Failure Modes","10.5281/zenodo.18525350","10.5281/zenodo.18525349","https://doi.org/10.5281/zenodo.18525350","https://zenodo.org/records/18525350"
"18525328","18525328","done","True","L5 Structural Novelty II New Envelope Intersections","10.5281/zenodo.18525328","10.5281/zenodo.18525327","https://doi.org/10.5281/zenodo.18525328","https://zenodo.org/records/18525328"
"18525303","18525303","done","True","L4 Structural Novelty I New Witnesses","10.5281/zenodo.18525303","10.5281/zenodo.18525302","https://doi.org/10.5281/zenodo.18525303","https://zenodo.org/records/18525303"
"18525289","18525289","done","True","L3 The Perpetually Open Measurement Class Uncertainty","10.5281/zenodo.18525289","10.5281/zenodo.18525288","https://doi.org/10.5281/zenodo.18525289","https://zenodo.org/records/18525289"
"18525268","18525268","done","True","L2 The Unclosable Contingent Reality","10.5281/zenodo.18525268","10.5281/zenodo.18525267","https://doi.org/10.5281/zenodo.18525268","https://zenodo.org/records/18525268"
"18525257","18525257","done","True","L1 Closure Taxonomy What Closure Is and Is Not","10.5281/zenodo.18525257","10.5281/zenodo.18525256","https://doi.org/10.5281/zenodo.18525257","https://zenodo.org/records/18525257"
"18525093","18525093","done","True","Family 3 Witnesses","10.5281/zenodo.18525093","10.5281/zenodo.18525092","https://doi.org/10.5281/zenodo.18525093","https://zenodo.org/records/18525093"
"18524929","18524929","done","True","Post Exhaustion Operator Closure Under Admissibility","10.5281/zenodo.18524929","10.5281/zenodo.18524928","https://doi.org/10.5281/zenodo.18524929","https://zenodo.org/records/18524929"
"18524900","18524900","done","True","Model Theoretic Collapse","10.5281/zenodo.18524900","10.5281/zenodo.18524899","https://doi.org/10.5281/zenodo.18524900","https://zenodo.org/records/18524900"
"18524877","18524877","done","True","Fixed_Point_Theorems_as_Standing_Traps","10.5281/zenodo.18524877","10.5281/zenodo.18524876","https://doi.org/10.5281/zenodo.18524877","https://zenodo.org/records/18524877"
"18524852","18524852","done","True","Universality_as_Closure_Saturation","10.5281/zenodo.18524852","10.5281/zenodo.18524851","https://doi.org/10.5281/zenodo.18524852","https://zenodo.org/records/18524852"
"18524769","18524769","done","True","Closure Certificates Forced Coincidence in Admissible Representational Regimes","10.5281/zenodo.18524769","10.5281/zenodo.18524768","https://doi.org/10.5281/zenodo.18524769","https://zenodo.org/records/18524769"
"18524752","18524752","done","True","Generator Terminal Closure Meta Foundational Re Anchoring","10.5281/zenodo.18524752","10.5281/zenodo.18524751","https://doi.org/10.5281/zenodo.18524752","https://zenodo.org/records/18524752"
"18524733","18524733","done","True","Generator Terminal Closure Model Theoretic Existence","10.5281/zenodo.18524733","10.5281/zenodo.18524732","https://doi.org/10.5281/zenodo.18524733","https://zenodo.org/records/18524733"
"18524712","18524712","done","True","Generator Terminal Closure Compactness and Saturation","10.5281/zenodo.18524712","10.5281/zenodo.18524711","https://doi.org/10.5281/zenodo.18524712","https://zenodo.org/records/18524712"
"18524703","18524703","done","True","Generator Terminal Closure Typicality and Measure","10.5281/zenodo.18524703","10.5281/zenodo.18524702","https://doi.org/10.5281/zenodo.18524703","https://zenodo.org/records/18524703"
"18524683","18524683","done","True","Generator Terminal Closure Completion as an Operator","10.5281/zenodo.18524683","10.5281/zenodo.18524682","https://doi.org/10.5281/zenodo.18524683","https://zenodo.org/records/18524683"
"18524667","18524667","done","True","Generator Terminal Closure Universal Property Existence","10.5281/zenodo.18524667","10.5281/zenodo.18524666","https://doi.org/10.5281/zenodo.18524667","https://zenodo.org/records/18524667"
"18524656","18524656","done","True","Generator Terminal Closure Infinity as an Operator","10.5281/zenodo.18524656","10.5281/zenodo.18524655","https://doi.org/10.5281/zenodo.18524656","https://zenodo.org/records/18524656"
"18524641","18524641","done","True","Generator Terminal Closure Canonical Representatives and Quotients","10.5281/zenodo.18524641","10.5281/zenodo.18524640","https://doi.org/10.5281/zenodo.18524641","https://zenodo.org/records/18524641"
"18524619","18524619","done","True","Closure Operator Exhaustion of Meta Foundational Re Anchoring","10.5281/zenodo.18524619","10.5281/zenodo.18524618","https://doi.org/10.5281/zenodo.18524619","https://zenodo.org/records/18524619"
"18524609","18524609","done","True","Closure Operator Exhaustion of Model Theoretic Existence","10.5281/zenodo.18524609","10.5281/zenodo.18524608","https://doi.org/10.5281/zenodo.18524609","https://zenodo.org/records/18524609"
"18524592","18524592","done","True","Closure Certificate Exhaustion of Choice Selection Operators Under Admissibility","10.5281/zenodo.18524592","10.5281/zenodo.18524591","https://doi.org/10.5281/zenodo.18524592","https://zenodo.org/records/18524592"
"18524572","18524572","done","True","Closure Certificate for Genericity Forcing Operators Under Admissibility","10.5281/zenodo.18524572","10.5281/zenodo.18524571","https://doi.org/10.5281/zenodo.18524572","https://zenodo.org/records/18524572"
"18524555","18524555","done","True","Closure Certificate for Choice Selection Operators Under Admissibility","10.5281/zenodo.18524555","10.5281/zenodo.18524554","https://doi.org/10.5281/zenodo.18524555","https://zenodo.org/records/18524555"
"18524531","18524531","done","True","Closure Certificate for Admissibility and Standing Repair","10.5281/zenodo.18524531","10.5281/zenodo.18524530","https://doi.org/10.5281/zenodo.18524531","https://zenodo.org/records/18524531"
"18524516","18524516","done","True","A Mathematical Closure Certificate for Operator Totalization","10.5281/zenodo.18524516","10.5281/zenodo.18524515","https://doi.org/10.5281/zenodo.18524516","https://zenodo.org/records/18524516"
"18524504","18524504","done","True","Generator Terminal Closure Meta Foundational Re Anchoring","10.5281/zenodo.18524504","10.5281/zenodo.18524503","https://doi.org/10.5281/zenodo.18524504","https://zenodo.org/records/18524504"
"18524451","18524451","done","True","Admissibility Obstruction for Genericity Forcing Operators","10.5281/zenodo.18524451","10.5281/zenodo.18524450","https://doi.org/10.5281/zenodo.18524451","https://zenodo.org/records/18524451"
"18524435","18524435","done","True","On the Inadmissibility of Completion as an Operator","10.5281/zenodo.18524435","10.5281/zenodo.18524434","https://doi.org/10.5281/zenodo.18524435","https://zenodo.org/records/18524435"
"18524417","18524417","done","True","On the Inadmissibility of Typicality and Measure as Operators","10.5281/zenodo.18524417","10.5281/zenodo.18524416","https://doi.org/10.5281/zenodo.18524417","https://zenodo.org/records/18524417"
"18524401","18524401","done","True","On the Inadmissibility of Compactness and Saturation as Operators","10.5281/zenodo.18524401","10.5281/zenodo.18524400","https://doi.org/10.5281/zenodo.18524401","https://zenodo.org/records/18524401"
"18524387","18524387","done","True","On the Inadmissibility of Canonical Representatives and Quotients as Operators","10.5281/zenodo.18524387","10.5281/zenodo.18524386","https://doi.org/10.5281/zenodo.18524387","https://zenodo.org/records/18524387"
"18524377","18524377","done","True","On the Inadmissibility of Infinity as an Operator","10.5281/zenodo.18524377","10.5281/zenodo.18524376","https://doi.org/10.5281/zenodo.18524377","https://zenodo.org/records/18524377"
"18524360","18524360","done","True","On the Inadmissibility of Universal Property Existence as an Operator","10.5281/zenodo.18524360","10.5281/zenodo.18524359","https://doi.org/10.5281/zenodo.18524360","https://zenodo.org/records/18524360"
"18524321","18524321","done","True","On the Inadmissibility of Model Theoretic Existence as an Operator","10.5281/zenodo.18524321","10.5281/zenodo.18524320","https://doi.org/10.5281/zenodo.18524321","https://zenodo.org/records/18524321"
"18524295","18524295","done","True","On the Inadmissibility of Meta Foundational ReAnchoring as an Operator","10.5281/zenodo.18524295","10.5281/zenodo.18524294","https://doi.org/10.5281/zenodo.18524295","https://zenodo.org/records/18524295"
"18524280","18524280","done","True","Admissibility and the Collapse of Typicality","10.5281/zenodo.18524280","10.5281/zenodo.18524279","https://doi.org/10.5281/zenodo.18524280","https://zenodo.org/records/18524280"
"18524262","18524262","done","True","Admissibility and the Non Existence of Intrinsic Attribution Predicates","10.5281/zenodo.18524262","10.5281/zenodo.18524261","https://doi.org/10.5281/zenodo.18524262","https://zenodo.org/records/18524262"
"18524228","18524228","done","True","Partial Algebras Operator Domains and the Impossibility of Total Extension","10.5281/zenodo.18524228","10.5281/zenodo.18524227","https://doi.org/10.5281/zenodo.18524228","https://zenodo.org/records/18524228"
"18523324","18523324","done","True","Vocabulary Normalization Appendix","10.5281/zenodo.18523324","10.5281/zenodo.18523323","https://doi.org/10.5281/zenodo.18523324","https://zenodo.org/records/18523324"
"18523317","18523317","done","True","The No Violations Doctrine","10.5281/zenodo.18523317","10.5281/zenodo.18523316","https://doi.org/10.5281/zenodo.18523317","https://zenodo.org/records/18523317"
"18523305","18523305","done","True","The No Exceptions Doctrine","10.5281/zenodo.18523305","10.5281/zenodo.18523304","https://doi.org/10.5281/zenodo.18523305","https://zenodo.org/records/18523305"
"18523294","18523294","done","True","The No Compliance Doctrine","10.5281/zenodo.18523294","10.5281/zenodo.18523293","https://doi.org/10.5281/zenodo.18523294","https://zenodo.org/records/18523294"
"18523289","18523289","done","True","The No Attempts Doctrine","10.5281/zenodo.18523289","10.5281/zenodo.18523288","https://doi.org/10.5281/zenodo.18523289","https://zenodo.org/records/18523289"
"18523282","18523282","done","True","Standing Failure Taxonomy for Proposed Theories","10.5281/zenodo.18523282","10.5281/zenodo.18523281","https://doi.org/10.5281/zenodo.18523282","https://zenodo.org/records/18523282"
"18523277","18523277","done","True","Standing Collapse Without Failure Semantics","10.5281/zenodo.18523277","10.5281/zenodo.18523276","https://doi.org/10.5281/zenodo.18523277","https://zenodo.org/records/18523277"
"18523270","18523270","done","True","Standing Collapse as Identity Loss","10.5281/zenodo.18523270","10.5281/zenodo.18523269","https://doi.org/10.5281/zenodo.18523270","https://zenodo.org/records/18523270"
"18523257","18523257","done","True","Representational Change Has No Standing Effects","10.5281/zenodo.18523257","10.5281/zenodo.18523256","https://doi.org/10.5281/zenodo.18523257","https://zenodo.org/records/18523257"
"18523250","18523250","done","True","Productive Constraint Governance","10.5281/zenodo.18523250","10.5281/zenodo.18523249","https://doi.org/10.5281/zenodo.18523250","https://zenodo.org/records/18523250"
"18523245","18523245","done","True","Possibility Without Viability","10.5281/zenodo.18523245","10.5281/zenodo.18523244","https://doi.org/10.5281/zenodo.18523245","https://zenodo.org/records/18523245"
"18523218","18523218","done","True","Ontic Availability as Constraint Governed Fixation","10.5281/zenodo.18523218","10.5281/zenodo.18523217","https://doi.org/10.5281/zenodo.18523218","https://zenodo.org/records/18523218"
"18523207","18523207","done","True","Objection Elimination Map Special Relativity","10.5281/zenodo.18523207","10.5281/zenodo.18523206","https://doi.org/10.5281/zenodo.18523207","https://zenodo.org/records/18523207"
"18523198","18523198","done","True","Non Negotiable Failure Conditions of the Maley Corpus","10.5281/zenodo.18523198","10.5281/zenodo.18523197","https://doi.org/10.5281/zenodo.18523198","https://zenodo.org/records/18523198"
"18523183","18523183","done","True","No Events at the Governance Layer","10.5281/zenodo.18523183","10.5281/zenodo.18523182","https://doi.org/10.5281/zenodo.18523183","https://zenodo.org/records/18523183"
"18523171","18523171","done","True","Interpretive Governance Appendix","10.5281/zenodo.18523171","10.5281/zenodo.18523170","https://doi.org/10.5281/zenodo.18523171","https://zenodo.org/records/18523171"
"18523110","18523110","done","True","Illicit Temporal Import at the Object Layer","10.5281/zenodo.18523110","10.5281/zenodo.18523109","https://doi.org/10.5281/zenodo.18523110","https://zenodo.org/records/18523110"
"18523101","18523101","done","True","How GR and QM Are Unified","10.5281/zenodo.18523101","10.5281/zenodo.18523100","https://doi.org/10.5281/zenodo.18523101","https://zenodo.org/records/18523101"
"18523092","18523092","done","True","Governance First General Relativity (GR 1 - GR 11)","10.5281/zenodo.18523092","10.5281/zenodo.18523091","https://doi.org/10.5281/zenodo.18523092","https://zenodo.org/records/18523092"
"18523082","18523082","done","True","Governance Eventlessness and the Prohibition of Process Semantics","10.5281/zenodo.18523082","10.5281/zenodo.18523081","https://doi.org/10.5281/zenodo.18523082","https://zenodo.org/records/18523082"
"18523065","18523065","done","True","Failure Mode Classification Epistemic vs Non Epistemic","10.5281/zenodo.18523065","10.5281/zenodo.18523064","https://doi.org/10.5281/zenodo.18523065","https://zenodo.org/records/18523065"
"18523056","18523056","done","True","Eventlessness and the Illicit Importation of Dynamics","10.5281/zenodo.18523056","10.5281/zenodo.18523055","https://doi.org/10.5281/zenodo.18523056","https://zenodo.org/records/18523056"
"18523042","18523042","done","True","Counterfactual Illegitimacy at the Governance Layer","10.5281/zenodo.18523042","10.5281/zenodo.18523041","https://doi.org/10.5281/zenodo.18523042","https://zenodo.org/records/18523042"
"18523026","18523026","done","True","Constraint Licensed Quantum Mechanics CLQM","10.5281/zenodo.18523026","10.5281/zenodo.18523025","https://doi.org/10.5281/zenodo.18523026","https://zenodo.org/records/18523026"
"18523018","18523018","done","True","Constraint Licensed General Relativity","10.5281/zenodo.18523018","10.5281/zenodo.18523017","https://doi.org/10.5281/zenodo.18523018","https://zenodo.org/records/18523018"
"18523008","18523008","done","True","Constraint Bundles and Ontic Availability","10.5281/zenodo.18523008","10.5281/zenodo.18523007","https://doi.org/10.5281/zenodo.18523008","https://zenodo.org/records/18523008"
"18522993","18522993","done","True","Confinement Invariants as Grammar","10.5281/zenodo.18522993","10.5281/zenodo.18522992","https://doi.org/10.5281/zenodo.18522993","https://zenodo.org/records/18522993"
"18522983","18522983","done","True","Comparative Illegitimacy at the Governance Layer","10.5281/zenodo.18522983","10.5281/zenodo.18522982","https://doi.org/10.5281/zenodo.18522983","https://zenodo.org/records/18522983"
"18522962","18522962","done","True","Beyond Standard Model Extensions as Illicit Extensions","10.5281/zenodo.18522962","10.5281/zenodo.18522961","https://doi.org/10.5281/zenodo.18522962","https://zenodo.org/records/18522962"
"18522949","18522949","done","True","Adversarial Testing Standard Declarative Statement","10.5281/zenodo.18522949","10.5281/zenodo.18522948","https://doi.org/10.5281/zenodo.18522949","https://zenodo.org/records/18522949"
"18522863","18522863","done","True","Admissible Output Only Semantics","10.5281/zenodo.18522863","10.5281/zenodo.18522862","https://doi.org/10.5281/zenodo.18522863","https://zenodo.org/records/18522863"
"18522850","18522850","done","True","Admissibility Governed Bookkeeping Regimes","10.5281/zenodo.18522850","10.5281/zenodo.18522849","https://doi.org/10.5281/zenodo.18522850","https://zenodo.org/records/18522850"
"18522800","18522800","done","True","A Mechanical Test for Representation Dependence","10.5281/zenodo.18522800","10.5281/zenodo.18522799","https://doi.org/10.5281/zenodo.18522800","https://zenodo.org/records/18522800"
"18522741","18522741","done","True","Why Self Modifying or Self Extending Agents Are CG Inadmissible","10.5281/zenodo.18522741","10.5281/zenodo.18522740","https://doi.org/10.5281/zenodo.18522741","https://zenodo.org/records/18522741"
"18522732","18522732","done","True","Unification and Embedding Programs as Illicit Scope Transport","10.5281/zenodo.18522732","10.5281/zenodo.18522731","https://doi.org/10.5281/zenodo.18522732","https://zenodo.org/records/18522732"
"18522720","18522720","done","True","SA_7 Periodic Table of Reality as Constraint Species Ledger","10.5281/zenodo.18522720","10.5281/zenodo.18522719","https://doi.org/10.5281/zenodo.18522720","https://zenodo.org/records/18522720"
"18522709","18522709","done","True","SA_6 Standing Failure as Stress Singularity","10.5281/zenodo.18522709","10.5281/zenodo.18522708","https://doi.org/10.5281/zenodo.18522709","https://zenodo.org/records/18522709"
"18522696","18522696","done","True","SA_5 Redescription Legality Under Role Preservation","10.5281/zenodo.18522696","10.5281/zenodo.18522695","https://doi.org/10.5281/zenodo.18522696","https://zenodo.org/records/18522696"
"18522688","18522688","done","True","SA_4 Constraint Bundles as Load Bearing Tensors","10.5281/zenodo.18522688","10.5281/zenodo.18522687","https://doi.org/10.5281/zenodo.18522688","https://zenodo.org/records/18522688"
"18522660","18522660","done","True","SA_3 Licensing as an Interior Projection","10.5281/zenodo.18522660","10.5281/zenodo.18522659","https://doi.org/10.5281/zenodo.18522660","https://zenodo.org/records/18522660"
"18522655","18522655","done","True","SA_2 The AMetric Boundary as Non Transmissive Interface","10.5281/zenodo.18522655","10.5281/zenodo.18522654","https://doi.org/10.5281/zenodo.18522655","https://zenodo.org/records/18522655"
"18522650","18522650","done","True","SA_1 Anchor Tensor Skin Role Taxonomy","10.5281/zenodo.18522650","10.5281/zenodo.18522649","https://doi.org/10.5281/zenodo.18522650","https://zenodo.org/records/18522650"
"18522646","18522646","done","True","Non Extendability in Artificial Agents","10.5281/zenodo.18522646","10.5281/zenodo.18522645","https://doi.org/10.5281/zenodo.18522646","https://zenodo.org/records/18522646"
"18522642","18522642","done","True","Physical Kernels as Hard Admissibility Gates for Theory Proposals","10.5281/zenodo.18522642","10.5281/zenodo.18522641","https://doi.org/10.5281/zenodo.18522642","https://zenodo.org/records/18522642"
"18522634","18522634","done","True","M5 Legitimacy Conservation Across Domains","10.5281/zenodo.18522634","10.5281/zenodo.18522633","https://doi.org/10.5281/zenodo.18522634","https://zenodo.org/records/18522634"
"18522628","18522628","done","True","M4 Failure Modes of Illegitimate Systems","10.5281/zenodo.18522628","10.5281/zenodo.18522627","https://doi.org/10.5281/zenodo.18522628","https://zenodo.org/records/18522628"
"18522610","18522610","done","True","M3 Domains of Legitimacy","10.5281/zenodo.18522610","10.5281/zenodo.18522609","https://doi.org/10.5281/zenodo.18522610","https://zenodo.org/records/18522610"
"18522602","18522602","done","True","M2 Definition of Legitimacy Without Metaphor","10.5281/zenodo.18522602","10.5281/zenodo.18522601","https://doi.org/10.5281/zenodo.18522602","https://zenodo.org/records/18522602"
"18522589","18522589","done","True","M1 Why Explanation Cannot Be the Primitive","10.5281/zenodo.18522589","10.5281/zenodo.18522588","https://doi.org/10.5281/zenodo.18522589","https://zenodo.org/records/18522589"
"18522563","18522563","done","True","Governance Corollary Operational Consequences of Reality Closure","10.5281/zenodo.18522563","10.5281/zenodo.18522562","https://doi.org/10.5281/zenodo.18522563","https://zenodo.org/records/18522563"
"18522549","18522549","done","True","G_2 Predictive Standing as a Terminal Act","10.5281/zenodo.18522549","10.5281/zenodo.18522548","https://doi.org/10.5281/zenodo.18522549","https://zenodo.org/records/18522549"
